{
  "contract_version": "1.0",
  "case": {
    "caption": "State v. Doe",
    "docket": "2026-CR-00042",
    "court": "14th JDC, Calcasieu Parish"
  },
  "generated": "2026-06-14T09:00:00-05:00",
  "path_base": "sidecar_dir",
  "exhibits": [
    {
      "id": "D-001",
      "party": "Defense",
      "description": "Photo of intersection",
      "file": "Exhibits_Admitted/d001-intersection.pdf",
      "status": "admitted",
      "media_type": "pdf",
      "witness": "Off. Smith",
      "bates": "DEF0001",
      "objection": "",
      "ruling": "Overruled",
      "notes": ""
    },
    {
      "id": "S-014",
      "party": "State",
      "description": "Pending body cam clip",
      "file": "Exhibits_Pending/s014-clip.pdf",
      "status": "pending",
      "media_type": "pdf",
      "witness": "",
      "bates": "",
      "objection": "",
      "ruling": "",
      "notes": ""
    },
    {
      "id": "D-009",
      "party": "Joint",
      "description": "Dashcam clip",
      "file": "Exhibits_Admitted/d009-clip.mov",
      "status": "admitted",
      "media_type": "video",
      "witness": "Off. Smith",
      "bates": "DEF0009",
      "objection": "",
      "ruling": "Overruled",
      "notes": ""
    },
    {
      "id": "A-001",
      "party": "Court",
      "description": "911 call recording",
      "file": "Exhibits_Admitted/a001-911.m4a",
      "status": "admitted",
      "media_type": "audio",
      "witness": "Dispatcher",
      "bates": "DEF0011",
      "objection": "",
      "ruling": "Overruled",
      "notes": ""
    }
  ]
}
